NCTId,BriefTitle,Acronym,OverallStatus,BriefSummary,HasResults,Condition,InterventionType,InterventionName,PrimaryOutcomeMeasure,SecondaryOutcomeMeasure,LeadSponsorName,CollaboratorName,Sex,MinimumAge,MaximumAge,StdAge,Phase,EnrollmentCount,LeadSponsorClass,StudyType,DesignPrimaryPurpose,OrgStudyId,SecondaryId,StartDate,PrimaryCompletionDate,CompletionDate,StudyFirstPostDate,ResultsFirstPostDate,LastUpdatePostDate,Timestamp
NCT06328725,Evaluate the Efficacy and Safety of EN001 in Patients With Duchenne Muscular Dystrophy,,NOT_YET_RECRUITING,"A Multi-center, Randomized, Double-blind, Placebo-controlled, Phase 1/2 Trial to Evaluate the Efficacy and Safety of EN001 in Patients with Duchenne Muscular Dystrophy",False,Duchenne Muscular Dystrophy,DRUG,EN001,"<Phase 1> Adverse drug reactions related to dose limiting toxicity (DLT), <Phase 1> Adverse drug reactions related to discontinuation of clinical trial drug administration, <Phase 2> Change in time to stand test (TTSTAND)","<Phase 1> Time to stand test (TTSTAND) change amount, <Phase 1> TTSTAND velocity (1/TTSTAND) change amount, <Phase 1> Time to run/walk 10 meters test (TTRW) change amount, <Phase 1> TTRW velocity (1/TTRW) change amount, <Phase 1> North Star Ambulatory Assessment (NSAA) change amount, <Phase 1> Time to climb 4 steps test (TTCLIMB) change amount, <Phase 1> TTCLIMB velocity (1/TTCLIMB) change amount, <Phase 1> 6-minute walk test (6MWT) change amount, <Phase 1> Changes amount in muscle strength by region, <Phase 1> Changes amount in parameters related to pulmonary function, <Phase 1> Changes amount in parameters related to cardiac function, <Phase 1> Change rate of creatine kinase (CK) at each visit after administration of investigational product compared to baseline (Visit 2), <Phase 2> Time to stand test (TTSTAND) change amount, <Phase 2> TTSTAND velocity (1/TTSTAND) change amount, <Phase 2> Time to run/walk 10 meters test (TTRW) change amount, <Phase 2> TTRW velocity (1/TTRW) change amount, <Phase 2> North Star Ambulatory Assessment (NSAA) change amount, <Phase 2> Time to climb 4 steps test (TTCLIMB) change, <Phase 2> TTCLIMB velocity (1/TTCLIMB) change amount, <Phase 2> 6-minute walk test (6MWT) change amount, <Phase 2> Changes amount in muscle strength by region, <Phase 2> Changes amount and rate of change in whole thigh muscle volume and index assessed by MRI, <Phase 2> Changes amount in parameters related to pulmonary function, <Phase 2> Changes amount in parameters related to cardiac function, <Phase 2> Change rate of creatine kinase (CK) at each visit after administration of investigational product compared to baseline (Visit 2), <Phase 2> Pediatric Outcomes Data Collection Instrument (PODCI) item score and total score change, <Phase 2> Pediatric Quality of Life inventory™ (PedsQL™) item scores and total score change, <Phase 1> Adverse Event, <Phase 1> Laboratory examination, <Phase 1> Vital sign, <Phase 2> Adverse Event, <Phase 2> Laboratory examination, <Phase 2> Vital sign",ENCell,,MALE,6 Years,11 Years,CHILD,"PHASE1, PHASE2",88,INDUSTRY,INTERVENTIONAL,TREATMENT,EN001_POWER,,2024-03,2025-11,2025-11,2024-03-25,,2024-03-25,2024-12-10T07:22:19.264591
NCT03039686,"Clinical Trial to Evaluate the Efficacy, Safety, and Tolerability of RO7239361 in Ambulatory Boys With Duchenne Muscular Dystrophy",,COMPLETED,"This is a multi-center, randomized, double-blind, placebo-controlled study to assess the efficacy, safety and tolerability of two different weekly doses of RO7239361 in ambulatory boys with Duchenne Muscular Dystrophy (DMD).",True,Duchenne Muscular Dystrophy,"DRUG, DRUG","RO7239361, Placebo for RO7239361","Baseline for the North Star Ambulatory Assessment (NSAA) Total Score, Change From Baseline in the North Star Ambulatory Assessment (NSAA) Total Score at Week 48","Baseline Time for 4 Stair Climb, Change From Baseline at Week 48 in 4 Stair Climb Velocity (4SCV), Baseline for the Time to Stand From Supine, Change From Baseline at Week 48 in Stand From Supine Velocity, Baseline Time for 10 Meter Walk/Run, Change From Baseline at Week 48 in 10 M Walk/Run Velocity, Baseline for the Pediatric Outcome Data Collection Instrument (PODCI) Transfer and Basic Mobility Subscale, Change From Baseline at Week 48 in Pediatric Outcome Data Collection Instrument (PODCI) Transfer and Basic Mobility Subscale, Change From Baseline at Week 48 in Proximal Lower Extremity Flexor Strength, Baseline for the 6 Minute Walk Distance (6MWD), Change From Baseline at Week 48 in 6 Minute Walk Distance (6MWD), Percentage of Participants for Each Clinical Global Impression of Change (CGI-C) Assessment Status at Week 48, Change From Baseline at Week 48 in 95th Percentile Stride Velocity, Number of Participants With Adverse Events (AEs), Number of Participants With AEs Leading to Discontinuation",Hoffmann-La Roche,,MALE,6 Years,11 Years,CHILD,"PHASE2, PHASE3",166,INDUSTRY,INTERVENTIONAL,TREATMENT,CN001-016,"2016-001654-18, WN40227",2017-07-06,2020-04-28,2020-04-28,2017-02-01,2020-12-21,2020-12-21,2024-12-10T07:22:19.264591
NCT02147639,Effects of Sodium Nitrate on Blood Flow in Becker Muscular Dystrophy,,COMPLETED,This study is intended to build on a growing body of literature showing a blood flow abnormality in patients with Becker muscular dystrophy. The investigators' laboratory recently showed that this blood flow abnormality could be corrected by a single oral dose of the drug Tadalafil (also known as Cialis). The investigators now wish to replicate these exciting results using a common nitric oxide donor (sodium nitrate).,False,Becker Muscular Dystrophy,"DIETARY_SUPPLEMENT, DIETARY_SUPPLEMENT, DIETARY_SUPPLEMENT, PROCEDURE","Sodium Nitrate, Sodium Nitrate - double dose, Placebo, Increased exercise intensity",Skeletal muscle blood flow,,Cedars-Sinai Medical Center,,MALE,15 Years,45 Years,"CHILD, ADULT","PHASE2, PHASE3",19,OTHER,INTERVENTIONAL,OTHER,NANO3,,2013-10,2014-05,2014-05,2014-05-28,,2020-01-14,2024-12-10T07:22:19.264591
NCT02315339,European Home Mechanical Ventilation Registry,EHMVR,TERMINATED,"The European Home Mechanical Ventilation Registry (EHMVR) will enable a thorough evaluation of HMV by documenting the characteristics of HMV patients and their treatment. This will facilitate a prospective, observational study to identify the primary indications for HMV, describe patterns of HMV use in European countries, and characterize changes in the initiation and utilization of HMV over time. The registry will target all adult individuals who have an indication for HMV. In the EHMVR, patient data from routine clinical care will be documented using an electronic case report form (eCRF). The eCRF will record: patient demographic data; diagnostic information (including primary diagnosis, 6-minute walk time, the presence of depression, and quality of life); blood gases; ventilation treatment (including type of ventilator, modes and settings, interfaces used); follow-up data (including failure rates, side effects, technical issues). An initial Pilot Phase will be launched with the aim to enrol at least 200 patients over a 6-month period to determine the feasibility of the registry. Steering committee members and their institutions will be the main participants in the Pilot Phase. After completion of the Pilot Phase, the registry will be expanded across Europe with the goal of enrolling approximately 10,000 patients over 5 years.",False,"Pulmonary Disease, Chronic Obstructive, Amyotrophic Lateral Sclerosis, Spinal Cord Injury, Muscular Dystrophies, Obesity Hypoventilation Syndrome, Kyphoscoliosis, Congenital Central Hypoventilation Syndrome, Duchenne Muscular Dystrophy, Myopathies, Myotonic Dystrophy",,,Determine the mortality rate and the number of hospital readmissions,Determine the effects of home mechanical ventilation on health-related quality of life using the EQ-5D and the Severe Respiratory Insufficiency questionnaires quality of life,ResMed,"Clinical Trial Center North Hamburg Germany, CRI-The Clinical Research Institute GmbH",ALL,,,"CHILD, ADULT, OLDER_ADULT",,37,INDUSTRY,OBSERVATIONAL,,CTC11633,,2014-08,2019-01,2019-01,2014-12-11,,2020-04-09,2024-12-10T07:22:19.264591
NCT05019625,Biomarker Development for Muscular Dystrophies,,RECRUITING,"Current methods of measuring the response to new treatments for muscular dystrophies involve the examination of small pieces of muscle tissue called biopsies. The investigators are interested in finding less invasive methods that reduce the need for muscle biopsies. The purpose of this research is to learn about the possibility of detecting and measuring the activity and severity of muscular dystrophies by examining a urine sample and a blood sample, and some muscles in the arms and legs using tests called ultrasound and electrical impedance myography; both tests are painless and non-invasive. The information that is gathered from this study may help to evaluate, prevent, diagnose, treat, and improve the understanding of human muscle diseases.",False,"Myotonic Dystrophy, Duchenne Muscular Dystrophy, Becker Muscular Dystrophy, Facioscapulohumeral Muscular Dystrophy",,,Extracellular RNA in biofluids,,Massachusetts General Hospital,"Boston Children's Hospital, Wake Forest University, University of Pittsburgh, Brigham and Women's Hospital",ALL,5 Years,,"CHILD, ADULT, OLDER_ADULT",,465,OTHER,OBSERVATIONAL,,2014P001727,,2015-02-20,2026-06,2027-06,2021-08-25,,2023-10-06,2024-12-10T07:22:19.264591
NCT03354039,Tamoxifen in Duchenne Muscular Dystrophy,TAMDMD,COMPLETED,"A randomised, double blind, placebo controlled, 48-week clinical trial with a core population (group A) of 79 ambulant 6.5 to 12 years old Duchenne's muscular dystrophy (DMD) patients that are under stable standard treatment of care with glucocorticoids. Furthermore, the investigators plan to include 6-20 non-ambulant patients who do not receive glucocorticoids (as parallel group B), 10 to 16 years old, to obtain efficacy and safety data in a broader DMD population. All patients will receive 20 mg of tamoxifen (TAM) or placebo once daily during 48 weeks.

An open label extension (OLE) trial for participants of the TAMDMD main study will be performed. All TAMDMD patients on TAM or placebo are offered to enter this OLE.",False,Duchenne Muscular Dystrophy,"DRUG, DRUG","Tamoxifen, Matching placebo",Reduction of disease progression,"Muscle function measured by D2 MFM subscore, Muscle function measured by D3 MFM subscore, Muscle function measured by North Star Ambulatory Assessment, Muscle function measured by proximal upper limb function, Muscle function measured by 6 minute walking distance in meter, Muscle function measured by 10 meter walking time in seconds, Muscle function measured by time to rise from lying on the floor / supine up in seconds, Muscle force measured by quantitative muscle testing (using Myogrip), Muscle Degeneration measured by MRI","University Hospital, Basel, Switzerland",,MALE,78 Months,16 Years,CHILD,PHASE3,93,OTHER,INTERVENTIONAL,TREATMENT,TAMDMD,,2018-06-12,2022-07-25,2022-10-18,2017-11-27,,2022-12-20,2024-12-10T07:22:19.264591
NCT02310763,"A Phase 2 Study to Evaluate the Safety, Efficacy, Pharmacokinetics and Pharmacodynamics of PF-06252616 in Duchenne Muscular Dystrophy",,TERMINATED,"This is a Phase 2 randomized, 2-period, double-blind, placebo-controlled, multiple ascending dose study to evaluate the safety, efficacy, PK and PD of PF-06252616 administered to ambulatory boys diagnosed with Duchenne Muscular Dystrophy. Three intravenous (IV) dose levels will be investigated in a within subject dose escalating fashion. Subjects will be randomly assigned to 1 of 3 sequence groups for approximately 96 weeks (2 periods of 48 weeks each). In period 1, two of the sequence groups will receive PF-06252616 and one sequence group will receive placebo. In period 2, the placebo group will switch to PF-06252616 and the two remaining sequence groups will either receive placebo or PF-06252616. Efficacy will be based on an observed mean change from baseline on function (4 stair climb) of PF-06252616 as compared to the placebo at the end of period 1. Period 2 provides an opportunity to evaluate PK. Subjects will receive monthly IV infused doses of either PF-06252616 or placebo and will undergo safety evaluations (Laboratory, cardiac monitoring, physical exams, x-ray, MRI), functional evaluations (pulmonary function testing, 4 stair climb, range of motion, strength testing, Northstar Ambulatory Assessment, upper limb functional testing and the six minute walk test), pharmacokinetic testing and pharmacodynamic testing to evaluate changes in muscle volume (MRI).",True,Duchenne Muscular Dystrophy,"BIOLOGICAL, DRUG","PF-06252616, Placebo","Number of Participants With Treatment-emergent Adverse Events (TEAEs) by Week 49, Number of Participants Who Discontinued From the Study Due to TEAEs by Week 49, Number of Participants With Dose Reduced or Temporary Discontinuation Due to TEAEs by Week 49, Number of Participants With Laboratory Test Abnormalities (Without Regard to Baseline Abnormality) by Week 49 - Hematology, Number of Participants With Laboratory Test Abnormalities (Without Regard to Baseline Abnormality) by Week 49 - Coagulation, Number of Participants With Laboratory Test Abnormalities (Without Regard to Baseline Abnormality) by Week 49 - Liver Function, Number of Participants With Laboratory Test Abnormalities (Without Regard to Baseline Abnormality) by Week 49 - Renal Function, Number of Participants With Laboratory Test Abnormalities (Without Regard to Baseline Abnormality) by Week 49 - Electrolytes, Number of Participants With Laboratory Test Abnormalities (Without Regard to Baseline Abnormality) by Week 49 - Hormones, Number of Participants With Laboratory Test Abnormalities (Without Regard to Baseline Abnormality) by Week 49 - Clinical Chemistry, Number of Participants With Laboratory Test Abnormalities (Without Regard to Baseline Abnormality) by Week 49 - Urinalysis, Number of Participants With Laboratory Test Abnormalities (Without Regard to Baseline Abnormality) by Week 49 - Fecal, Categorical Summary of Liver Iron Accumulation by Week 49, Number of Participants With Physical Examination Findings Reported as SAEs by Week 49, Summary of Tanner Stage Rating by Week 49, Number of Participants With Vital Signs Findings Reported as SAEs by Week 49, Number of Participants With Electrocardiogram (ECG) Data Meeting Pre-specified Criteria by Week 49, Change From Baseline in Left Ventricular Ejection Fraction (LVEF) as Compared to Placebo by Week 49, Height-adjusted Z-score of Lumbar Spine Bone Mineral Density Over Time by Week 49, Bone Age to Chronological Age Ratio by Week 49, Number of Participants With Suicidal Ideation and Suicidal Behavior Reported as AEs by Week 49, Change From Baseline on the 4 Stair Climb (4SC) as Compared to Placebo at Weeks 17, 33 and 49","Change From Baseline as Compared to Placebo on Forced Vital Capacity (FVC) at Weeks 17, 33 and 49, Change From Baseline as Compared to Placebo on the Northstar Ambulatory Assessment (NSAA) at Weeks 17, 33 and 49, Change From Baseline as Compared to Placebo on the Ankle Range of Motion (ROM) at Weeks 17, 33 and 49, Change From Baseline as Compared to Placebo on the Performance of Upper Limb (PUL) Overall Score at Weeks 17, 33 and 49, Change From Baseline as Compared to Placebo on the Six Minute Walk Distance (6MWD) Score at Weeks 17, 33 and 49, Change From Baseline as Compared to Placebo on Muscle Strength of Elbow Extension at Weeks 17, 33 and 49, Change From Baseline as Compared to Placebo on Muscle Strength of Elbow Flexion at Weeks 17, 33 and 49, Change From Baseline as Compared to Placebo on Muscle Strength of Hip Abduction at Weeks 17, 33 and 49, Change From Baseline as Compared to Placebo on Muscle Strength of Knee Extension at Weeks 17, 33 and 49, Change From Baseline as Compared to Placebo on Muscle Strength of Shoulder Abduction at Weeks 17, 33 and 49, Change From Baseline to Week 49 on 4SC for Participants in Sequence 3 Compared to the Natural History Control Group, Change From Baseline to Week 97 on 4SC for Participants in Sequence 1 Compared to the Natural History Control Group, Change From Baseline to Week 49 on FVC for Participants in Sequence 3 Compared to the Natural History Control Group, Change From Baseline to Week 97 on FVC for Participants in Sequence 1 Compared to the Natural History Control Group, Change From Baseline to Week 49 on NSAA for Participants in Sequence 3 Compared to the Natural History Control Group, Change From Baseline to Week 97 on NSAA for Participants in Sequence 1 Compared to the Natural History Control Group, Change From Baseline to Week 49 on 6MWD for Participants in Sequence 3 Compared to the Natural History Control Group, Change From Baseline to Week 97 on 6MWD for Participants in Sequence 1 Compared to the Natural History Control Group, Change From Baseline as Compared to Placebo on 4SC at Week 17 in Pre-specified Subsets, Change From Baseline as Compared to Placebo on 4SC at Week 33 in Pre-specified Subsets, Change From Baseline as Compared to Placebo on 4SC at Week 49 in Pre-specified Subsets, Change From Baseline as Compared to Placebo on FVC at Week 17 in Pre-specified Subsets, Change From Baseline as Compared to Placebo on FVC at Week 33 in Pre-specified Subsets, Change From Baseline as Compared to Placebo on FVC at Week 49 in Pre-specified Subsets, Change From Baseline as Compared to Placebo on NSAA at Week 17 in Pre-specified Subsets, Change From Baseline as Compared to Placebo on NSAA at Week 33 in Pre-specified Subsets, Change From Baseline as Compared to Placebo on NSAA at Week 49 in Pre-specified Subsets, Change From Baseline as Compared to Placebo on PUL Overall Scores at Week 17 in Pre-specified Subsets, Change From Baseline as Compared to Placebo on PUL Overall Score at Week 33 in Pre-specified Subsets, Change From Baseline as Compared to Placebo on PUL Overall Score at Week 49 in Pre-specified Subsets, Change From Baseline as Compared to Placebo on 6MWD at Week 17 in Pre-specified Subsets, Change From Baseline as Compared to Placebo on 6MWD at Week 33 in Pre-specified Subsets, Change From Baseline as Compared to Placebo on 6MWD at Week 49 in Pre-specified Subsets, Change From Baseline on Muscle Strength at Weeks 17, 33 and 49 in Pre-specified Subset (Baseline 4SC <3.5 Seconds), Change From Baseline on Muscle Strength at Weeks 17, 33 and 49 in Pre-specified Subset (Baseline 4SC >=3.5 Seconds and <=8 Seconds), Change From Baseline on Muscle Strength at Weeks 17, 33 and 49 in Pre-specified Subset (Baseline 4SC >8 Seconds), Percent Change From Baseline in Whole Thigh Muscle Volume as Compared to Placebo by Weeks 17, 33 and 49, Percent Change From Baseline as Compared to Placebo in Whole Thigh Muscle Volume Index by Weeks 17, 33 and 49, Change From Baseline in Whole Thigh Muscle Volume Through Week 97, Change From Baseline in Whole Thigh Muscle Volume Index Through Week 97, Concentration of Growth Differentiation Factor 8 (GDF-8) at Time 0 (Pre-dose),(C0(GDF-8) ), Trough Serum Concentration of GDF-8 (Ctrough,(GDF-8)) for Participants Receiving Domagrozumab in Period 1, Ctrough,(GDF-8) for Participants of Sequence 3 in Period 2, Trough (Pre-dose) Serum Concentration (Ctrough) of Domagrozumab, Maximum Serum Concentration (Cmax) of Domagrozumab, Time for Cmax (Tmax) of Domagrozumab, Terminal Half-life (t1/2) of Domagrozumab for Participants in Sequence 2 After the Last Dose of Domagrozumab, Area Under the Serum Concentration-time Curve Over the Dosing Interval Tau (AUCtau) of Domagrozumab, Average Serum Concentration Over the Dosing Interval (Cav) of Domagrozumab, Clearance (CL) of Domagrozumab, Volume of Distribution at Steady State (Vss) of Domagrozumab for Participants in Sequence 2 Required for Additional PK Assessment, Number of Participants With Anti-drug Antibodies (ADA) Development by Week 97",Pfizer,,MALE,6 Years,15 Years,CHILD,PHASE2,121,INDUSTRY,INTERVENTIONAL,TREATMENT,B5161002,2014-002072-92,2014-11-24,2018-04-30,2018-11-23,2014-12-08,2019-07-23,2020-12-07,2024-12-10T07:22:19.264591
NCT03238235,Clinical Study to Evaluate the Efficacy and Safety of Givinostat in Ambulant Patients With Becker Muscular Dystrophy,,COMPLETED,"Objectives:

Primary objective: to establish the histological effects of Givinostat versus placebo administered over 12 months.

Secondary Objectives:

* To establish the macroscopic muscle effects of Givinostat versus placebo administered over 12 months assessed by Magnetic Resonance Imaging (MRI)/Magnetic Resonance Spectroscopy (MRS).
* To determine the other histological effects of Givinostat versus placebo administered over 12 months.
* To establish the efficacy of Givinostat versus placebo administered chronically over 12 months in slowing disease progression.
* To assess the safety and tolerability of Givinostat versus placebo administered chronically.
* To evaluate the pharmacokinetic (PK) profile of Givinostat administered chronically in the target population.
* To evaluate the impact of Givinostat versus placebo administered chronically on quality of life and activities of daily living.",True,Becker Muscular Dystrophy,"DRUG, DRUG","Givinostat, Placebo","Mean Change From Baseline to Visit 11 in Total Fibrosis (%) on Log Scale, Comparing the Histology of Muscle Biopsies","Mean Change From Baseline to Visit 11 in the Percentage of Fat Fraction of Vastus Lateralis and Soleus, Mean Change From Baseline to Visit 11 in the Percentage of Fat Fraction of Lower Limb Muscles, Mean Change From Baseline to Visit 11 in Cross-sectional Area (CSA), in cm2 of Lower Limb Muscles, Mean Change From Baseline to Visit 11 in Contractile Area of Lower Limb Muscles (MRI), Mean Change From Baseline to Visit 11 in Biopsy Histology Parameters: CSA by Type (I or II Fibers), Total CSA, Mean Change From Baseline to Visit 11 in Percentage for the Following Histology Parameters: Fibers With Nuclear Centralizations (%), Total Number of Fibers (%), Regenerative Fibers (%)., Mean Change From Baseline to Visit 11 in Percentage for the Biopsy Histology Parameter MFA(%), Mean Change From Baseline to Visit 11 in Percentage for the Biopsy Histology Parameters Adipose Tissue (%), Mean Change From Baseline to Visit 11 in Other Histological Structures, Mean Change From Baseline to Visit 11 in Motor Function Measurement (MFM, Expressed as Log Least Square Mean), Mean Change From Baseline to Visit 11 in Time Function Test (TFT): Time to Walk/Run 10 Meters, Mean Change From Baseline to Visit 11 in Time Function Test (TFT) Via Time to Climb 4 Standard Steps, Mean Change From Baseline to Visit 11 in Time Function Test Via Time to Rise From Floor, Change From Baseline to Visit 11 in Distance Performed Via 6-minute Walk/Run Test (6MWT, Expressed as Log Least Square Mean), Percentage of Patients With < 10% Worsening in 6MWT After 12 Months of Treatment., Count of Participant Who Lose Ambulation During the Study (From Baseline to Month 12), Percentage of Patients Who Fell During the 6MWT, Mean Change From Baseline to Visit 11 in Muscle Strength Evaluated by Knee Extension, Elbow Flexion, Mean Changes From Baseline to Visit 11 in Quality of Life (QoL, Assessed by the 36-item Short Form Survey [SF36]), Number of Patients Experiencing Any Kind of Severity of TEAEs, Serious and Non Serious) From Baseline Through End of Study (EOS)., Mean Change From Baseline to Visit 11 in the Percentage of Fat Fraction of Lower Limb Muscles (Log), Mean Change From Baseline to Visit 11 in Contractile Area of Lower Limb Muscles (MRI) (Log), Mean Change From Baseline to Visit 11 in Biopsy Histology Parameters: CSA by Type (I or II Fibers), Total CSA (Log), Mean Change From Baseline to Visit 11 in Percentage for the Following Histology Parameters: Fibers With Nuclear Centralizations (%), Total Number of Fibers (%), Regenerative Fibers (%). (Log)",Italfarmaco,,MALE,18 Years,65 Years,"ADULT, OLDER_ADULT",PHASE2,51,INDUSTRY,INTERVENTIONAL,TREATMENT,DSC/15/2357/53,2017-001629-41,2018-01-09,2021-03-19,2021-03-19,2017-08-03,2024-11-18,2024-11-18,2024-12-10T07:22:19.264591
NCT00428935,Safety Study of Mini-dystrophin Gene to Treat Duchenne Muscular Dystrophy,,COMPLETED,The purpose of this study is to determine the safety of a miniature dystrophin gene in the treatment of progressive muscle weakness due to Duchenne Muscular Dystrophy (DMD).,False,Duchenne Muscular Dystrophy,BIOLOGICAL,rAAV2.5-CMV-minidystrophin (d3990),Number of Participants with Adverse Events as a Measure of Safety and Tolerability,"mini-dystrophin gene expression at the site of gene transfer, Maximal Volume Isometric Contraction Testing as a measure of muscle strength",Nationwide Children's Hospital,"Asklepios Biopharmaceutical, Inc.",MALE,5 Years,15 Years,CHILD,PHASE1,6,OTHER,INTERVENTIONAL,TREATMENT,CCRI IRB05-00118,,2006-03,2009-03,2010-07,2007-01-30,,2013-02-05,2024-12-10T07:22:19.264591
