NCTId,BriefTitle,Acronym,OverallStatus,BriefSummary,HasResults,Condition,InterventionType,InterventionName,PrimaryOutcomeMeasure,SecondaryOutcomeMeasure,LeadSponsorName,CollaboratorName,Sex,MinimumAge,MaximumAge,MinimumAgeMonths,MaximumAgeMonths,StdAge,Phase,EnrollmentCount,LeadSponsorClass,StudyType,DesignPrimaryPurpose,OrgStudyId,SecondaryId,StartDate,PrimaryCompletionDate,CompletionDate,StudyFirstPostDate,ResultsFirstPostDate,LastUpdatePostDate,Timestamp
NCT01030991,Classification of Heart Failure With Preserved Ejection Fraction,,Completed,The purpose of this study is to create a classification system for the heterogenous disorder of heart failure with preserved ejection fraction (HFpEF).,False,"Heart Failure With Preserved Ejection Fraction, Diastolic Heart Failure",,,"Heart failure hospitalization, Cardiovascular hospitalization, Mortality - all cause and cardiovascular",Exercise capacity (peak VO2),Northwestern University,,All,21 Years,,252.0,0.0,"Adult, Older Adult",,514,Other,Observational,,AHA 0835488N,,2008-07-01,2019-05-21,2019-05-21,2009-12-14,,2019-05-23,2025-07-22T14:56:11.992789
NCT04113291,Randomized Controlled Pilot Trial of DASH Feeding in Older Low Socioeconomic Adults Without Heart Failure,DASHF,Withdrawn,This is a study of the DASH diet (Dietary Approaches to Stop Hypertension) in the exploration of effective strategies for Heart failure (HF) with preserved ejection fraction (HFPEF) prevention.,False,"Heart Failure, Heart Failure With Preserved Ejection Fraction","Other, Other","DASH Diet, Usual diet","Number of enrolled participants per week, Proportion of participants that adhere to the to intervention, Number participants that were retained in the trial",Proportion of participants that adhere to the diet,Wake Forest University Health Sciences,,All,60 Years,74 Years,720.0,888.0,"Adult, Older Adult",Na,0,Other,Interventional,Prevention,DASHF-PRE,,2021-12-01,2022-06-01,2022-06-01,2019-10-02,,2020-10-05,2025-07-22T14:56:11.992789
NCT05393362,Effectiveness of a Cardiac Rehabilitation Program in Elderly Patients With Heart Failure.,FUNNEL+,Completed,"The main objective of the study is to assess the effectiveness of a cardiac rehabilitation program on functionality, measured by kinematic analysis, cardiorespiratory capacity, and ventricular ejection fraction in elderly patients with heart failure (HF). Other objectives will be; 1) to validate the kinematic analysis as an objective functional assessment that allows performing a functional stratification based on the severity of impairment (""kinematic phenotypes""), as well as to identify those patients who responders or are not responders to the cardiac rehabilitation program; 2) to develop a functional index that includes objective functional parameters, biomechanical biomarkers (heart and musculoskeletal echography) and physiological biomarkers (maximum consumption of oxygen (VO2 max), maximum heart rate (HR max) and blood lactate levels; 3) to analyse the degree of concordance of biomechanical biomarkers with functional tests normally used in clinical practice and with imaging and physiological biomarkers. A randomized, controlled, crossover clinical trial will be carried out at the Hospital Regional Universitario de Málaga. Clinically stable HF patients ≥70 years old will be included. The cardiac rehabilitation program will last 12 weeks and will follow the recommendations of the European Association of Cardiovascular Prevention and Rehabilitation. The patients will perform different functional tests, which will be at baseline, at 3 months and 6 months of follow-up.",False,"Heart Failure With Preserved Ejection Fraction, Sarcopenia, Frail Elderly Syndrome, Comorbidities and Coexisting Conditions","Procedure, Behavioral","Cardiac Rehabilitation Program (CR), Control Group (CG)","Physiological biomarkers_Cardiopulmonary Exercise Testing (CPET)-(Peak VO2), Physiological biomarkers_Cardiopulmonary Exercise Testing (CPET)-(Peak VO2), Physiological biomarkers_Cardiopulmonary Exercise Testing (CPET)-(Peak VO2)","Physiological biomarkers _Bioelectrical Impedance Analysis (BIA)- (PhA), Physiological biomarkers _Bioelectrical Impedance Analysis (BIA)- (R), Physiological biomarkers _Bioelectrical Impedance Analysis (BIA)- (Xc), Physiological biomarkers _Bioelectrical Impedance Analysis (BIA)- (FFM), Physiological biomarkers _Bioelectrical Impedance Analysis (BIA)- (FM), Physiological biomarkers _Bioelectrical Impedance Analysis (BIA)- (BCM), Physiological biomarkers _Bioelectrical Impedance Analysis (BIA)- (ECW), Physiological biomarkers _Bioelectrical Impedance Analysis (BIA)- (TBW), Physiological biomarkers _Bioelectrical Impedance Analysis (BIA)- (ECW/TBW), Physiological biomarkers _Spirometric assessment-(TV), Physiological biomarkers _Spirometric assessment-(VC), Physiological biomarkers _Spirometric assessment-(IRV), Physiological biomarkers _Spirometric assessment-(ERV), Physiological biomarkers _Spirometric assessment-(IC), Physiological biomarkers _Spirometric assessment-(FVC), Physiological biomarkers _Spirometric assessment-(FEV1), Physiological biomarkers _Spirometric assessment-(PEF), Physiological biomarkers _Spirometric assessment-(MIP), Physiological biomarkers _Spirometric assessment-(MEP), Physiological biomarkers _Dynamometric assesment-(MDR-Hd-sEMG), Physiological biomarkers _Dynamometric assesment-(VC-Hd-sEMG), Physiological biomarkers _Dynamometric assesment- (F-Iso-FD-din), Physiological biomarkers _Dynamometric assesment- (F-Iso-FD-S), Physiological biomarkers _Dynamometric assesment-Timed Up and Go (TUG), Physiological biomarkers _Dynamometric assesment-Six minute walk test (6-MWT), Physiological biomarkers _Dynamometric assesment-Short Physical performance Battery (SPPB), Physiological biomarkers_Metabolic biomarkers_Blood lactate, Physiological biomarkers _Cardiopulmonary Exercise Testing (CPET)-(Peak HR), Physiological biomarkers _Cardiopulmonary Exercise Testing (CPET)-(HRR), Physiological biomarkers _Cardiopulmonary Exercise Testing (CPET)-(VO2-VT1), Physiological biomarkers _Cardiopulmonary Exercise Testing (CPET)-(VO2/HR,O2 pulse), Physiological biomarkers _Cardiopulmonary Exercise Testing (CPET)-(CRE), Physiological biomarkers _Cardiopulmonary Exercise Testing (CPET)- (OUES), Physiological biomarkers _Cardiopulmonary Exercise Testing (CPET)-(RER), Physiological biomarkers _Cardiopulmonary Exercise Testing (CPET)-(PeakW), Physiological biomarkers _Cardiopulmonary Exercise Testing (CPET)-(ΔVO2/ΔWR), Physiological biomarkers _Cardiopulmonary Exercise Testing (CPET)-(PeakVE), Physiological biomarkers _Cardiopulmonary Exercise Testing (CPET)-(Vd/Vt), Physiological biomarkers _Cardiopulmonary Exercise Testing (CPET)-(VE/MVV), Physiological biomarkers _Cardiopulmonary Exercise Testing (CPET)-(PETCO2), Physiological biomarkers _Cardiopulmonary Exercise Testing (CPET)-(PETO2), Physiological biomarkers _Cardiopulmonary Exercise Testing (CPET)-(VE/VCO2), Physiological biomarkers _Cardiopulmonary Exercise Testing (CPET)-(VE/VO2), Physiological biomarkers_Blood biomarkers_ Complete Blood Cell Count (CBC)_hematocrit, Physiological biomarkers_Blood biomarkers_ Complete Blood Cell Count (CBC)_hemoglobin, Physiological biomarkers_Blood biomarkers_ Complete Blood Cell Count (CBC)_Mean Corpuscular Volume (MCV), Physiological biomarkers_Blood biomarkers_ Complete Blood Cell Count (CBC)_Mean Corpuscular Hemoglobin (MCH), Physiological biomarkers_Blood biomarkers_ Complete Blood Cell Count (CBC)_Mean Corpuscular Hemoglobin Concentration (MCHC), Physiological biomarkers_Blood biomarkers_ Complete Blood Cell Count (CBC)_Leukocytes, Physiological biomarkers_Blood biomarkers_ Complete Blood Cell Count (CBC)_Platelet count, Physiological biomarkers_Blood biomarkers_ Complete Blood Cell Count (CBC)_Glomerular Filtration Rate (GFR), Physiological biomarkers_Blood biomarkers_ Complete Blood Cell Count (CBC)_Creatinine, Physiological biomarkers_Blood biomarkers_ Complete Blood Cell Count (CBC)_Glucose, Physiological biomarkers_Blood biomarkers_ Complete Blood Cell Count (CBC)_Uric Acid, Physiological biomarkers_Blood biomarkers_ Complete Blood Cell Count (CBC)_sodium, potassium, calcium, Physiological biomarkers_Blood biomarkers_ Complete Blood Cell Count (CBC)_transaminases -ALT, AST, GGT, FA, Physiological biomarkers_Blood biomarkers_ Complete Blood Cell Count (CBC)_glycated hemoglobin, Physiological biomarkers_Blood biomarkers_ Complete Blood Cell Count (CBC)_ferritin, Physiological biomarkers_Blood biomarkers_ Complete Blood Cell Count (CBC)_iron, Physiological biomarkers_Blood biomarkers_ Complete Blood Cell Count (CBC)_Index of transferrin saturation, Physiological biomarkers_Blood biomarkers_ Complete Blood Cell Count (CBC)_transferrin, Physiological biomarkers_Blood biomarkers_ Complete Blood Cell Count (CBC)_ vitamin B12, Physiological biomarkers_Blood biomarkers_ Complete Blood Cell Count (CBC)_ folic acid, Physiological biomarkers_Blood biomarkers_ Complete Blood Cell Count (CBC)_ HDL, Physiological biomarkers_Blood biomarkers_ Complete Blood Cell Count (CBC)_ TSH, Physiological biomarkers_Blood biomarkers_ Complete Blood Cell Count (CBC)_ Total cholesterol (TC), Physiological biomarkers_Blood biomarkers_ Complete Blood Cell Count (CBC)_ LDL, Physiological biomarkers_Blood biomarkers_ Complete Blood Cell Count (CBC)_ albumin, Physiological biomarkers_Blood biomarkers_ Complete Blood Cell Count (CBC)_ triglycerides, Physiological biomarkers_Blood biomarkers_ Complete Blood Cell Count (CBC)_ NT-proBNP, Physiological biomarkers_Blood biomarkers_ Complete Blood Cell Count (CBC)_ vitamin D., Biomechanical biomarkers _ RGB-D camera (depth camera)_Trunk linear acceleration, Biomechanical biomarkers_ RGB-D camera (depth camera)_Trunk angular displacement, Biomechanical biomarkers _ RGB-D camera (depth camera)_Trunk angular velocity, Biomechanical biomarkers_ Shimmer3_Step and stride length, Biomechanical biomarkers_ Shimmer3_Step and stride time, Biomechanical biomarkers _ Shimmer3_Step and stride widths stride, Biomechanical biomarkers _ Shimmer3_Swing phase time gait, Biomechanical biomarkers _ Shimmer3_Gait speed (m/s), Biomechanical biomarkers _ Shimmer3_Stance phase, Biomechanical biomarkers _ Shimmer3_Step speed and stride., Biomechanical biomarkers _ Shimmer3_Step symmetry, Imaging biomarkers _Cardiac-Echocardiogram (LVEF), Imaging biomarkers _Cardiac-Echocardiogram (Dilatation and Diameter of the left atrium and left ventricle), Imaging biomarkers _Muscular-Echocardiographic (Muscle Thickness), Imaging biomarkers _Displacement-Echocardiographic (Slide-pL), Imaging biomarkers_Muscular-Echocardiographic (Fat Thickness), Imaging biomarkers_Muscular-Echocardiographic (Muscle Echo-Intensity), Imaging biomarkers_Muscular-Echocardiographic (Fat Echo-Intensity), Self-reported_ Borg Rating of Perceived Exertion (RPE)-Borg Scale, Self-reported_Sarcopenia Questionnaire (SARC-F), Self-reported_abbreviated Comprehensive Geriatric Assessment (aCGA):",University of Malaga,,All,70 Years,,840.0,0.0,Older Adult,Na,65,Other,Interventional,Treatment,Funnel+ Study,,2023-03-07,2025-07-01,2025-07-01,2022-05-26,,2025-07-10,2025-07-22T14:56:11.992789
NCT06560762,Study in Participants With Heart Failure With Preserved Ejection Fraction (HFpEF),,Recruiting,"A Phase 1, Open label, Multiple Ascending Dose Study to Assess Safety and Tolerability of STM-01 in Participants with Heart Failure with Preserved Ejection Fraction (HFpEF)",False,Heart Failure With Preserved Ejection Fraction (HFpEF),Drug,STM01,"Frequency, grade and relationship to STM-01 of unsolicited local and systemic AEs (any SAEs, MAAEs and AESIs ) during the 60-d follow-up period post IV infusion at D0 and D28 per the CTCAE v5.0 and clinical-safety laboratory parameters up to D 56.",,Secretome Therapeutics,,All,18 Years,,216.0,0.0,"Adult, Older Adult",Phase1,12,Industry,Interventional,Treatment,Phase 1 STM-01 HFpEF Study,,2025-03-03,2025-12-15,2025-12-15,2024-08-19,,2025-04-06,2025-07-22T14:56:11.992789
NCT03672591,Renal Hemodynamics in Patients With HFpEF,,Completed,"Impaired renal function and heart failure with preserved ejection fraction (HFpEF) are two often co-existing medical conditions and are known to be associated with adverse cardiovascular outcome and increased mortality. The relationship between HFpEF and renal impairment is bidirectional. On the one hand, renal dysfunction has been shown to be an independent risk factor for the development of HFpEF. On the other hand, an increase in central venous pressure leading to renal dysfunction by a reduction of renal blood flow (RBF) and perfusion pressure (RPP) as well as activation of the renin-angiotensin-aldosterone system (RAAS) in patients with HFpEF has been previously described.

In the literature, several studies aimed to investigate the association between renal (dys-) function and HFpEF. In all these studies, renal function was assessed by determination of standard kidney function parameters such as serum creatinine, eGFR and urinary albumin to creatinine ratio (UACR). Constant infusion input clearance technique however offers a more detailed evaluation of renal function and hemodynamics. To the best of knowledge, renal hemodynamics in patients with HFpEF have not yet been investigated by clearance technique. Therefore, the aim of the present study is to evaluate renal function and hemodynamics by means of constant infusion input clearance technique with sodium p-aminohippuric acid (PAH) and Iohexol in 40 patients with HFpEF. The constant infusion input clearance technique offers an exact evaluation of renal function by measuring (not estimating) glomerular filtration rate and renal hemodynamic parameters such as renal plasma flow (RPF), filtration fraction (FF) and intraglomerular pressure (IGP). These results will be compared to 140 subjects without HFpEF that have participated in various studies and have been analyzed with the same constant infusion input clearance technique performed in the Clinical Research Center of the University Hospital Erlangen-Nuremberg. Additionally, flow mediated vasodilation (FMD), pulse wave velocity and parameters of retinal vascular remodeling by means of scanning laser Doppler flowmetry (SLDF) will be assessed in patients with HFpEF thereby allowing to examine the relationship between vascular remodeling in the systemic and renal circulation.",False,Heart Failure With Normal Ejection Fraction,Other,Renal clearance examination,Renal plasma flow,"Flow mediated vasodilation, Wall to lumen ratio of retinal arterioles, Retinal capillary flow, Office and 24-hour systolic, diastolic and mean ambulatory blood pressure, Central systolic pressure, Pulse pressure, Pulse wave velocity, Glomerular filtration rate, Filtration fraction, Renal vascular resistance, Intraglomerular pressure",University of Erlangen-Nürnberg Medical School,,All,18 Years,85 Years,216.0,1020.0,"Adult, Older Adult",,40,Other,Observational,,CRC2018HFpEF,,2018-11-30,2019-06-30,2019-06-30,2018-09-14,,2019-07-10,2025-07-22T14:56:11.992789
NCT01045291,Pacing for Heart Failure With Preserved Ejection Fraction,HFpEF,Completed,"The purpose of this research study is to evaluate the safety of a new pacing method (Fusion Pacing) for heart failure patients with an ejection fraction (EF) greater than 50% over a period of 4 months, and determine the effects on different measures of heart failure. This new pacing method may allow the heart to pump more efficiently. Participation in this study will last approximately 8 months.",False,Heart Failure,Device,Cardiac Resynchronization Therapy-Defibrillator (CRT-D),"Number of adverse events while the Fusion Pacing download is active vs. inactive., Percentage of time the Fusion Pacing is active throughout a four-month follow-up period.","Change in Minnesota Living with Heart Failure Questionnaire score., Change in peak VO2 during Cardio-pulmonary Exercise Testing (CPX)., Change in echocardiography measures: E/E', Ejection Fraction, LV EDV., Change in NT-proBNP.",Medtronic Cardiac Rhythm and Heart Failure,,All,18 Years,,216.0,0.0,"Adult, Older Adult",Na,22,Industry,Interventional,Treatment,MDT0095101,,2010-06-01,2013-01-01,2013-01-01,2010-01-11,,2013-05-30,2025-07-22T14:56:11.992789
NCT06979362,A Research Study Comparing Different Doses of CDR132L With Placebo on the Structure and Function of the Heart in People With Heart Failure With Preserved Ejection Fraction and Left Ventricular Hypertrophy,8212-Preserved,Not Yet Recruiting,"This study will look into how CDR132L (a potential new medicine) works on the structure and function of the heart in people living with heart failure. Participants will either get CDR132L or placebo (a medicine which has no effect on the body), which treatment the participants get is decided by chance. The study will last for about 60 weeks.",False,Heart Failure,"Drug, Drug","CDR132L, Placebo",Main phase: Change in microRNA-132-3p (miR-132),"Main phase: Change in composite Z-score based on the 3 outcome measures LVMi (CMR), LAVi (CMR) and NT-proBNP, Main phase: Change in miR-132, Main phase: Number of adverse events, Extension phase: Number of adverse events",Novo Nordisk A/S,,All,40 Years,84 Years,480.0,1008.0,"Adult, Older Adult",Phase2,200,Industry,Interventional,Treatment,NN6706-8212,"U1111-1313-3984, 2024-515796-35",2025-07-01,2027-05-16,2028-01-23,2025-05-19,,2025-05-19,2025-07-22T14:56:11.992789
NCT04128891,Study of Sacubitril/ValsarTan on MyocardIal OxygenatioN and Fibrosis in Heart Failure With Preserved Ejection Fraction,PRISTINE-HF,Withdrawn,"To assess the effect of ARNI on myocardial deoxygenation at stress and myocardial fibrosis, and correlate this to changes in myocardial systolic and diastolic function in HFpEF patients.",False,Heart Failure With Preserved Ejection Fraction,Drug,Sacubitril-Valsartan,• To study the effects of Sacubitril/Valsartan on microvascular function and ischaemia in HFpEF patients.,"2.1 Incidence of microvascular dysfunction in HFpEF, 2.2 Extent of myocardial fibrosis in HFpEF, 2.3 Assessment of left ventricular diastolic function in HFpEF, 2.4 New York Heart Association (NYHA) class, 2.5 Functional assessment, 2.6 Number of heart failure related hospitalisations, 2.7 Cardiac mortality, 2.8 All-cause mortality.",Flinders University,,All,40 Years,,480.0,0.0,"Adult, Older Adult",Phase3,0,Other,Interventional,Treatment,FlindersU,,2020-02-01,2020-02-01,2024-02-01,2019-10-16,,2021-08-30,2025-07-22T14:56:11.992789
NCT03074591,Effect of IV Iron in Patients With Heart Failure With Preserved Ejection Fraction,FAIR-HFpEF,Completed,"This study addresses, whether treatment with IV iron for patients with heart failure with preserved ejection fraction (HFpEF) and iron deficiency (ID), both with or without anaemia, can improve exercise capacity as measured by 6-minute walking test (6-MWT) and symptoms while being safe",False,"Iron-deficiency, Heart Failure","Drug, Drug","Ferric Carboxymaltose 50Mg/Ml Inj 15Ml, Saline Solution for Injection",exercise capacity,"6min-walking distance, Patient Global Assessment (PGA), NYHA functional class, Change in quality of life assessments, Rate of recurrent heart failure hospitalisations and death","Charite University, Berlin, Germany",University of Göttingen,All,18 Years,,216.0,0.0,"Adult, Older Adult",Phase4,40,Other,Interventional,Treatment,Charite,,2017-08-01,2022-12-13,2024-04-10,2017-03-09,,2024-05-31,2025-07-22T14:56:11.992789
NCT04391491,Neuregulin-1 in Patient With Different Forms of Cardiovascular Diseases: a Pilot Study,NRG-1-CVDs,Completed,"This is an observational study of Neuregulin-1 (NRG-1) plasma levels in patients with different forms of cardiovascular disease including microvascular angina (MVA), heart failure with preserved ejection fraction (HFpEF), as well as, heart failure with reduced ejection fraction (HFrEF) and pulmonary hypertension (PH). Investigators intend to identify cardiovascular diseases which are characterized by increased circulating NRG-1, considered to be a biomarker of therapeutic potential of NRG-1. Participants will undergo blood sampling over 3 days following randomisation. Patients demographics and clinical characteristics will be recorded and their associations with NRG-1 will be analysed.",False,"Heart Failure With Preserved Ejection Fraction, Microvascular Angina, Pulmonary Hypertension, Heart Failure With Reduced Ejection Fraction",Diagnostic Test,Neuregulin-1β level in plasma,NRG-1 plasma concentrations,"Correlations between NRG-1 and NTproBNP, biomarkers of inflammation and fibrosis",I.M. Sechenov First Moscow State Medical University,"Universiteit Antwerpen, University of Basel",All,18 Years,75 Years,216.0,900.0,"Adult, Older Adult",,100,Other,Observational,,03-19 13022019,,2019-03-01,2022-12-01,2023-02-01,2020-05-18,,2023-05-03,2025-07-22T14:56:11.992789
NCT04835194,Phenotypes and Outcomes of Heart Failure With Preserved Ejection Fraction in Patients With Hypertension and Diabetes,,Completed,"Our study is the first multicenter study in Vietnam on clinical phenotypes of heart failure with preserved ejection fraction (HFpEF) in patients with concurrent type 2 diabetes (T2DM) and hypertension (HTN). The purpose of this study is to identify different phenotypes of the Vietnamese HFpEF-HTN-T2DM population, as well as the association of these phenotypes with long-term outcomes.",False,"Heart Failure With Preserved Ejection Fraction, Diabetes Mellitus, Type 2, Hypertension",,,"Phenotypes of heart failure with preserved ejection fraction in patients with concurrent hypertension and diabetes., Composite primary endpoint, Combined endpoint, The correlation between clinical phenotypes and composite primary endpoint, The correlation between clinical phenotypes and combined endpoint","Occurence of HHF (first and recurrent) in patients with heart failure with preserved ejection fraction and concurrent hypertension, diabetes., All cause mortality in patients with heart failure with preserved ejection fraction and concurrent hypertension, diabetes., Cardiovascular mortality in patients with heart failure with preserved ejection fraction and concurrent hypertension, diabetes., Time to first occurence of HHF (first and recurrent) in patients with heart failure with preserved ejection fraction and concurrent hypertension, diabetes., Time to first all cause mortality in patients with heart failure with preserved ejection fraction and concurrent hypertension, diabetes, Time to first cardiovascular mortality in patients with heart failure with preserved ejection fraction and concurrent hypertension, diabetes.",University of Medicine and Pharmacy at Ho Chi Minh City,,All,18 Years,,216.0,0.0,"Adult, Older Adult",,233,Other,Observational,,2129-ĐHYD,,2020-12-01,2023-01-01,2023-02-28,2021-04-08,,2023-03-02,2025-07-22T14:56:11.992789
NCT05878912,The Effect of Obesity and Weight Loss in Heart Failure With Preserved Ejection Fraction,OWL-HFPEF,Recruiting,"This study looks at the effects of weight loss in people who have heart failure with preserved ejection fraction (HFpEF) and are overweight or obese.

The main questions it aims to answer are whether weight loss in this group of people improves:

1. The heart's shape, how well it pumps blood and how well it uses fuels
2. The person's quality of life and how much they can exercise

Participants will attend 2 study visits, separated by 3-6 months. The intervention period takes place in between the 2 study visits.

Each study visit will involve measurements including:

* Symptom and quality of life questionnaires
* Body measurements such as height and weight
* Blood tests
* Ultrasound scans of the heart (echocardiogram)
* Magnetic Resonance Imaging (MRI) scans of the heart
* Exercise components during the scans
* 6 minute walk test

Participants are randomly allocated (in other words, by lottery) to either 'diet' or 'control' groups. The control group will continue standard care.

The diet group will be enrolled in a weight loss program supervised by the study team. Participants in the diet group will replace their usual meals with meal replacement products specifically designed to deliver a low calorie diet for weight loss. The products will consist of formula soups, shakes and porridges. This diet would last 8 weeks, followed by a guided period of food reintroduction and maintenance.",False,"Heart Failure With Preserved Ejection Fraction, Obesity",Other,Diet intervention,Left atrial volume,"Body weight, Six minute walk distance, N-terminal pro brain natriuretic peptide (NT pro BNP), Kansas City Cardiomyopathy Questionnaire (KCCQ)",University of Oxford,British Heart Foundation,All,18 Years,85 Years,216.0,1020.0,"Adult, Older Adult",Na,120,Other,Interventional,Treatment,161729 (C),"15/SC/0004, FS/CRTF/22/24293",2023-01-20,2025-10-01,2026-12-01,2023-05-30,,2024-04-24,2025-07-22T14:56:11.992789
