NCTId,BriefTitle,Acronym,OverallStatus,BriefSummary,HasResults,Condition,InterventionType,InterventionName,PrimaryOutcomeMeasure,SecondaryOutcomeMeasure,LeadSponsorName,CollaboratorName,Sex,MinimumAge,MaximumAge,MinimumAgeMonths,MaximumAgeMonths,StdAge,Phase,EnrollmentCount,LeadSponsorClass,StudyType,DesignPrimaryPurpose,OrgStudyId,SecondaryId,StartDate,PrimaryCompletionDate,CompletionDate,StudyFirstPostDate,ResultsFirstPostDate,LastUpdatePostDate,Timestamp
NCT03251183,Validation of CMR Against Invasive Haemodynamics in Patients With HFpEF,DECIPHER-HFpEF,Completed,"Heart failure (HF) currently affects app. 2% of the western population and app. 10% of people \>75 years. In about 50% of patients with symptomatic HF ejection fraction (EF) is preserved (HF-PEF). Once patients develop symptoms, the prognosis is poor with 25% mortality at 1 year and 50% mortality at 5 years. HFpEF is one of the major unresolved areas in clinical cardiology. The diagnosis of HFpEF remains a diagnosis of exclusion and currently no non-invasive measure provides a clear diagnosis.

Cardiovascular magnetic resonance (CMR) provides non invasive and radiation free evaluation of heart structure and function. New CMR parameters offer the possibility to describe the underlying pathological and physiological changes associated with HFpEF.

The investigators propose to undertake the first systematic comparison between a CMR protocol and invasive haemodynamics as the best possible gold standard, as well as define the histopathological drivers in myocardial biopsies. The investigators will also examine the relations with tissue and serological biomarkers implicated in HFpEF and the role with standard and novel parameters by echocardiography. If successful, this study will provide tools for a reliable and accurate non-invasive characterization of patients with HFpEF, supporting the diagnosis and grading the severity of disease. This study will provide a reference basis for future diagnostic algorithms in HFpEF, both, for CMR and echocardiography, but also for their relative value in comparison to blood markers or invasive testing. In addition to a new pathway to acess the effects of current and novel therapeutic interventions, the investigators see the greatest potential in identifying a disease stage where the myocardial injury may be reversible.",False,Heart Failure With Normal Ejection Fraction,"Diagnostic Test, Diagnostic Test, Diagnostic Test, Diagnostic Test, Diagnostic Test","Comprehensive Cardiovascular magnetic resonance (CMR), Blood sampling, TTE (EchoErgo), Invasive pressure-volume (PV) Loops, Left ventricular (LV) biopsy",Significant influence of MR Imaging Parameters on a multivariate model to describe the invasive pressure volume relations (EDPVR).,"Association between CMR T1-mapping and biopsy results., Association between CMR flow echocardiographic flow, Association between a model for diastolic function based on CMR with a model of diastolic function based on echocardiography, Association between CMR function and echocardiographic function, Discriminatory capacity of a multivariate model of invasive and a multivariate model of non-invasive variables., Reproducibility at one site., Variability between the different sites.",Goethe University,Deutsches Zentrum für Herz-Kreislauf-Forschung (DZHK),All,18 Years,,216.0,0.0,"Adult, Older Adult",,185,Other,Observational,,Protocol_ Version 1 20170225,,2018-01-14,2022-12-31,2022-12-31,2017-08-16,,2023-03-10,2025-07-22T14:56:11.992789
NCT06316661,CMR Assessment of Cardiac Microvascular Dysfunction in Patients With HFpEF,MAPPED,Recruiting,"Heart failure with preserved ejection fraction (HFpEF) causes hospitalizations, premature mortality and high health care costs. This is also due to poor understanding of HFpEF pathogenesis and, thus, lack of specific therapies. Prompted by the recent demonstration that HFpEF clusters different clinical phenotypes, the investigators propose that these phenogroups are driven by distinct myocardial abnormalities. Cardiac Magnetic Resonance (CMR) can help filling this gap in knowledge: on top of providing gold standard measurements for myocardial volume and cellular mass, recent technical advantages mean that this test can assess and quantify left ventricular extracellular volume, fibrosis and microvascular function accurately and non-invasively. In HFpEF patients, the investigators aim at assessing 1) the coronary microvascular function impairment; 2) the myocardial fibrotic burden; - seeking to understand the disease in order to improve care and cardiovascular outcomes for these patients.",False,"Microvascular Coronary Artery Disease, Heart Failure With Reduced Ejection Fraction","Diagnostic Test, Diagnostic Test","stress perfusion cardiac magnetic resonance, cardiopulmonary exercise test","Peak stress perfusion, Extracellular volume",,Istituto Auxologico Italiano,,All,18 Years,,216.0,0.0,"Adult, Older Adult",,60,Other,Observational,,09C921,,2019-03-01,2024-12-30,2024-12-30,2024-03-18,,2024-03-18,2025-07-22T14:56:11.992789
NCT02728154,The Role of Gut Microbiota in Heart Failure and Pre-Heart Failure With Preserved Ejection Fraction,,Withdrawn,"Gut microbiota play an important role in normal cardiovascular function and pathophysiology of cardiovascular diseases. Patients with heart failure (HF) have substantial hemodynamic changes which lead to intestinal hypoperfusion and congestion and eventually change gut morphology, permeability, function and composition of gut microbiota and cause translocation of microbial and endotoxins into the blood stream. Additionally, metabolites derived from gut microbiota modulate the pathophysiology of HF. Patients with HF have intestinal overgrowth of pathogenic bacteria and increased gut permeability. Accumulating evidence demonstrates that antibiotic treatment benefits patients with acute coronary syndromes and reduces the incidence of ischemic cardiovascular events. Taking the strong association of gut microbiota with HF into account, it is reasonable to speculate that gut microbiota could contribute to the progression of pre-HF with preserved ejection fraction (pre-HFpEF) to HF with preserved ejection fraction (HFpEF). Pre-HFpEF remains poorly understood, yet has high prevalence and a significantly high risk for death in comparison to patient without pre-HFpEF. We hypothesize that altered gut microbiota is involved in the initiation and establishment of HF and pre-HFpEF.",False,Heart Failure,"Other, Other","Blood Sample, Stool Sample",Stool sample for fecal microbiota between the groups,"Blood samples for inflammatory cytokines between the groups, Blood samples for SAA between the groups, Blood samples for inflammatory cells between the groups",University of Florida,,All,18 Years,,216.0,0.0,"Adult, Older Adult",,0,Other,Observational,,IRB201600380 - N,,2016-10-01,2025-06-08,2025-06-08,2016-04-05,,2025-04-10,2025-07-22T14:56:11.992789
NCT01989299,Ventricular Tachyarrhythmia Detection by Implantable Loop Recording in Patients With Heart Failure and Preserved Ejection Fraction,VIP-HF,Completed,"Heart failure with preserved ejection fraction (HFPEF) is a large medical problem, for which no drug or device has a recommendation in current heart failure guidelines. Sudden cardiac death is suggested as the most common cause of death in HFPEF patients, although data is sparse. Use of an Implantable Loop Recorder (ILR) may be useful in patients with HFPEF to evaluate the incidence of sustained ventricular tachyarrhythmias. If ventricular tachyarrhythmias are seem frequently, treatment with an Implantable Cardioverter Defibrillator (ICD) may be an option in the future.",False,Heart Failure With Preserved Ejection Fraction (HFpEF),Device,ILR implantation,The incidence of sustained ventricular tachyarrhythmias.,"The incidence of atrial fibrillation (AF) in patients without baseline or history of AF, The rate of progression of AF in patients without baseline or history of AF, The incidence of HF hospitalizations, all cause mortality, cardiovascular mortality, and sudden cardiac death, The incidence of non-sustained ventricular tachyarrhythmias, Biomarkers (including ECG, Holter, echocardiography, CMR and blood biomarkers) for incident AF, and progression of AF in patients without baseline or history of AF, Biomarkers (including ECG, Holter, echocardiography, CMR and blood biomarkers) of sustained ventricular tachyarrhythmias, Biomarkers (including ECG, Holter, echocardiography, CMR and blood biomarkers) of non-sustained ventricular tachyarrhythmias, Biomarkers (including echocardiography, ECG and other arrhythmogenic markers and blood biomarkers) for development of HF hospitalizations, sudden death, arrhythmic death, and all-cause mortality",University Medical Center Groningen,Abbott Medical Devices,All,18 Years,,216.0,0.0,"Adult, Older Adult",,113,Other,Observational,,VIP-HF Registry,,2014-11-01,2019-12-01,2020-06-01,2013-11-20,,2022-05-23,2025-07-22T14:56:11.992789
NCT04235699,Ketogenic Diet in Patients With Heart Failure,,Terminated,"This study is being done to evaluate the effects of a low carbohydrate ketogenic diet on exercise tolerance in patients with Heart Failure with Preserved Ejection Fraction (HFpEF), also known as Diastolic Heart Failure (DHF).",False,Heart Failure With Preserved Ejection Fraction,Other,Nutritional and Dietary Manipulation,Changes in maximal exercise performance,"Change in CMR measures of cardiac function, Change in NYHA class, Change in Quality of Life Questionnaire, Change in Serologic Markers",Ohio State University,,All,18 Years,75 Years,216.0,900.0,"Adult, Older Adult",Na,4,Other,Interventional,Treatment,2019H0255,,2019-12-22,2022-12-31,2022-12-31,2020-01-22,,2024-07-24,2025-07-22T14:56:11.992789
NCT03310099,"Unsaturated Fatty Acids Enriched-diet to Improve Cardiorespiratory Fitness, Metabolic Flexibility and Glucose Tolerance in Obese Patients",,Completed,"The investigators hypothesize that a dietary intervention aimed at increasing unsaturated fatty acids (UFA) consumption is feasible and has the potential to improve cardiorespiratory fitness, metabolic flexibility and glucose tolerance in symptomatic obese heart failure with preserved ejection fraction (HFpEF) patients.",False,"Heart Failure With Normal Ejection Fraction, Obesity",Behavioral,Increasing daily unsaturated fatty acid consumption,"Change in 24-hour dietary recall, Change in dietary compliance (biomarkers)","Change in metabolic flexibility, Change in body composition, Change in glucose tolerance",Virginia Commonwealth University,,All,18 Years,,216.0,0.0,"Adult, Older Adult",Na,16,Other,Interventional,Treatment,HM20011363,,2017-10-23,2018-10-04,2018-10-04,2017-10-16,,2019-04-18,2025-07-22T14:56:11.992789
NCT05057806,"SGLT2 Inhibitors, Ketones, and Cardiovascular Benefit Research Plan",,Recruiting,"The study team will examine the effects of SGLT2i (and SGLT2i-induced increases in plasma ketone concentrations) on skeletal muscle and cardiac ketone uptake, skeletal muscle bioenergetics, cardiopulmonary exercise capacity, and patient-reported functional outcomes.",False,"Type2 Diabetes, Heart Failure With Preserved Ejection Fraction","Drug, Drug","Empagliflozin 25 MG, Placebo","Change in Phosphocreatine, Change in Adenosine Triphosphate (ATP), Change in Inorganic Phosphate, Change in Phosphodiester, ATPmax production","Plasma Beta-hydroxybutyrate (β-OH-B), Acetoacetate concentrations, Cardiopulmonary Function, 6 minute walk test, Patient-Reported Outcomes Measure Information System (PROMIS)",The University of Texas Health Science Center at San Antonio,"Doris Duke Charitable Foundation, Max and Minnie Tomerlin Voelcker Fund",All,18 Years,80 Years,216.0,960.0,"Adult, Older Adult",Early Phase1,30,Other,Interventional,Basic Science,HSC20210528H,2021176,2021-01-13,2026-11-30,2027-03-31,2021-09-27,,2025-03-30,2025-07-22T14:56:11.992789
NCT03641599,Right Ventricular Function in Heart Failure,,Completed,"Only a few studies evaluated the RV systolic function in the three categories of HF, regarding the importance of understanding changes in RV function on clinical presentation and outcome; it was essential to understand the prevalence and severity of RV dysfunction among the three groups and the degree of correlation between RV with LV systolic function.",False,Assessment of the RV Function in Patients With Heart Faliure,Diagnostic Test,echocardiography,assessment of the RV systolic dysfunction in patients with heart failure,,shaimaa Mostafa,,All,18 Years,,216.0,0.0,"Adult, Older Adult",,150,Other,Observational,,RV,,2017-01-01,2018-06-01,2018-07-01,2018-08-22,,2018-08-22,2025-07-22T14:56:11.992789
NCT03833336,Effects of Iron Therapy in Heart Failure With Preserved Ejection Fraction and Iron Deficiency (PREFER-HF),PREFER-HF,Completed,"The purpose of the study is to evaluate whether the administration of iron to patients with heart failure and preserved ejection fraction results in an improvement of symptoms and functional class, in addition to evaluating whether oral iron is equivalent to intravenous iron to achieve this improvement.",False,"Heart Failure With Normal Ejection Fraction, Ferropenic Anemia","Other, Drug, Drug, Drug","Placebo, Ferric carboxymaltose, Ferroglycine Sulfate, Sucrosomial Iron",Six minute walking test distance,"Change in New York Heart Association (NYHA) functional classification, Quality of Life assesed by Kansas City Cardiomyopathy Questionnaire, Hospitalizations, Mortality",Institut de Recerca Biomèdica de Lleida,Fundació La Marató de TV3,All,18 Years,,216.0,0.0,"Adult, Older Adult",Phase3,72,Other,Interventional,Treatment,PREFER-HF,2016-003604-31,2017-08-23,2024-09-15,2024-12-20,2019-02-07,,2025-05-21,2025-07-22T14:56:11.992789
NCT06803849,Association of Heterogeneous Circulating Biomarkers and Anamnestic Factors of Pregnancy Adverse Course and Outcomes With the Prognosis of Heart Failure With Preserved Ejection Fraction,CARPO-HF,Recruiting,"The primary purpose of this study is to evaluate possible association of some heterogeneous circulating biomarkers and anamnestic factors of pregnancy adverse course and outcomes with the prognosis of heart failure with preserved ejection fraction. The study population includes women aged 60-74 years with history of pregnancy with duration at least 20 weeks and diagnosed heart failure with preserved ejection fraction based on algorithm HFA-PEFF.

The following pregnancy complications are assessed on the initial visit: gestational hypertension, preeclampsia, gestation diabetes mellitus and recently introduced as cardiovascular disease risk factors preterm delivery, stillbirth, miscarriage. This information is collected through a questionnaire which additionally includes questions about menopause and the circumstances of its onset. The data about comorbidities, results of laboratory and instrumental tests is collected from medical records. After the interview short physical examination is performed to measure anthropometric data and objective signs of congestion. In addition, medical Research Council Scale survey is conducted to assess the subjective severity of shortness of breath and a six-minute walking test to objectively evaluate the heart failure functional class.

After inclusion in the study blood sampling is performed to measure the concentration of a number of biomarkers which are recognized as prognostically significant in context of heart failure: high-sensitivity troponin I, soluble suppression of tumorigenicity 2 protein, heat shock protein 27, cystatin C. As part of the study echocardiography is also performed with evaluation of left ventricular global longitudinal strain and left atrial strain to assess systolic and diastolic myocardium function.

12 months after the initial visit, participants are contacted by telephone. The data about newly diagnosed chronic non-communicable diseases, emergency hospitalization for any cause and major adverse cardiovascular events is collected. If there is no response from the research participant, the cause, including possible hospitalization or death, is determined by telephone contact with the participant's trusted person.",False,Heart Failure With Preserved Ejection Fraction (HFPEF),,,"Combined endpoint made up of emergency hospitalization for any cause, major adverse cardiovascular events and all-cause mortality",Newly diagnosed chronic non-communicable disease,National Medical Research Center for Therapy and Preventive Medicine,,Female,60 Years,74 Years,720.0,888.0,"Adult, Older Adult",,100,Other Gov,Observational,,04-07/24,,2024-11-15,2025-12-31,2026-12-31,2025-01-31,,2025-01-31,2025-07-22T14:56:11.992789
NCT03619213,Dapagliflozin Evaluation to Improve the LIVEs of Patients With PReserved Ejection Fraction Heart Failure.,DELIVER,Completed,"This is an international, multicentre, parallel-group, event-driven, randomised, double-blind, placebo-controlled study in HFpEF patients, evaluating the effect of dapagliflozin 10 mg versus placebo, given once daily in addition to background regional standard of care therapy, including treatments to control co-morbidities, in reducing the composite of CV death or heart failure events.",True,Heart Failure With Preserved Ejection Fraction,"Drug, Drug","Dapagliflozin, Placebo","Subjects Included in the Composite Endpoint of CV Death, Hospitalization Due to Heart Failure or Urgent Visit Due to Heart Failure., Subjects Included in the Composite Endpoint of CV Death, Hospitalization Due to Heart Failure or Urgent Visit Due to Heart Failure for LVEF <60% Subpopulation","Events Included in the Composite Endpoint of CV Death or Recurrent Heart Failure Event (Hospitalization Due to Heart Failure or Urgent Heart Failure Visit), Events Included in the Composite Endpoint of CV Death or Recurrent Heart Failure Event (Hospitalization Due to Heart Failure or Urgent Heart Failure Visit) for LVEF <60% Subpopulation, Change From Baseline in the KCCQ Total Symptom Score at 8 Months, Subjects Included in the Endpoint of Cardiovascular Death, Subjects Included in the Endpoint of All-cause Mortality",AstraZeneca,,All,40 Years,130 Years,480.0,1560.0,"Adult, Older Adult",Phase3,6263,Industry,Interventional,Treatment,D169CC00001,2018-000802-46,2018-08-27,2022-03-27,2022-03-27,2018-08-07,2023-07-11,2023-07-11,2025-07-22T14:56:11.992789
NCT04886713,Adipose Tissue Inflammation in HFpEF,SLIM-HFpEF,Unknown,"To evaluate the role of adipose tissue inflammation in patients with heart failure with preserved ejection fraction (HFpEF). Patients undergoing coronary artery bypass grafting with HFpEF and without heart failure will be included in this prospective study. Epicardial, paracardial, paraaortic/paravascular, subcutaneous adipose tissue samples as well as myocardial tissue will be harvested during cardiac surgery. Inflammatory patterns of these tissues and their relation to circulating markers will be investigated.",False,"Heart Failure With Preserved Ejection Fraction, Obesity","Diagnostic Test, Diagnostic Test, Diagnostic Test","Adipose and myocardial tissue sampling, Cardiac magnetic resonance imaging, Cardiopulmonary exercise testing",Adipose tissue inflammation,"Evaluation of serum adipokine levels, Cardiac MRI - Myocardial function, Cardiac MRI - Epicardial fat, Echocardiography, Functional capacity on spiroergometry, Stress echocardiography",Heart Center Leipzig - University Hospital,,All,18 Years,,216.0,0.0,"Adult, Older Adult",,30,Other,Observational,,SLIM-HFpEF V1.0,,2019-11-01,2021-12-31,2022-03-15,2021-05-14,,2021-05-14,2025-07-22T14:56:11.992789
NCT05126836,Cilostazol for HFpEF,,Completed,"Determine if cilostazol improves symptoms and NTproBNP levels (heart failure blood marker) in heart failure with preserved ejection fraction (HFpEF) - a prevalent syndrome without targeted evidence-based treatment.

This will be assessed in a prospective 1-month single blinded study with 2 cross-overs n-of-1 study design with placebo and cilostazol",True,Heart Failure With Preserved Ejection Fraction,"Drug, Drug","Cilostazol 100Mg Tab, Placebo",KCCQ-12,NTproBNP,University of Minnesota,,All,18 Years,,216.0,0.0,"Adult, Older Adult",Phase2,25,Other,Interventional,Treatment,CV-2020-29436,,2021-09-01,2022-06-01,2022-07-01,2021-11-19,2023-12-15,2023-12-15,2025-07-22T14:56:11.992789
