NCTId,BriefTitle,Acronym,OverallStatus,BriefSummary,HasResults,Condition,InterventionType,InterventionName,PrimaryOutcomeMeasure,SecondaryOutcomeMeasure,LeadSponsorName,CollaboratorName,Sex,MinimumAge,MaximumAge,MinimumAgeMonths,MaximumAgeMonths,StdAge,Phase,EnrollmentCount,LeadSponsorClass,StudyType,DesignPrimaryPurpose,OrgStudyId,SecondaryId,StartDate,PrimaryCompletionDate,CompletionDate,StudyFirstPostDate,ResultsFirstPostDate,LastUpdatePostDate,Timestamp
NCT05129722,"Polydiuretic Therapy for HFpEF, a Randomised Controlled Trial",,Terminated,"Heart Failure (HF) in Australia affects 1-2% of the population. Heart failure with preserved ejection fraction (HFpEF) refers to a syndrome of clinical heart failure without impairment of systolic cardiac function. HFpEF has few therapeutic agents that are proven to improve outcomes and it was only recently, the published EMPEROR-Preserved trial demonstrated that empagliflozin, a sodium-glucose cotransporter 2 inhibitor (SGLT2i) reduced composite outcome of heart failure hospitalisation and cardiovascular death by 21% among patients with HFpEF.\[1\] HFpEF therapies have traditionally aimed at providing symptomatic relief and treating coexisting illnesses.

This multi-centre randomised clinical trial aims to establish the feasibility of a fixed low dose combination polypill consisting of bumetanide 0.5 mg, eplerenone 25 mg, and empagliflozin 10 mg in patients with HFpEF compared against empagliflozin 10 mg monotherapy in patients with HFpEF.

Fixed dose combination low dose diuretics of this nature have not been rigorously studied in patients with HFpEF, and this study aims to help improve the treatment paradigm for this patient population.",False,Heart Failure With Preserved Ejection Fraction,"Drug, Drug","Low dose combination polydiuretic therapy, Comparator monotherapy empagliflozin",Feasibility of recruitment and compliance with study protocol (30 participants and 80% participant completion of study protocol),"NT-proBNP, NYHA Class, 6-minute Walk Test (6MWT) distance, Systolic and Diastolic Blood Pressure, Body Weight, Haemoglobin A1c, Haemoglobin and haematocrit, Renal Function, Potassium, Total Diuretic Dose, Pill Burden",The George Institute,"Victor Chang Cardiac Research Institute, St Vincent's Centre for Applied Medical Research, Royal Prince Alfred Hospital, Sydney, Australia",All,18 Years,,216.0,0.0,"Adult, Older Adult",Phase4,3,Other,Interventional,Treatment,2021/PID02198,,2022-10-01,2024-05-01,2024-05-01,2021-11-22,,2024-11-21,2025-07-22T14:56:11.992789
NCT04942548,Reverse HFpEF: Ketogenic Reversal of Heart Failure With Preserved Ejection Fraction Study,,Completed,"This protocol is a prospective pilot study utilizing the intervention of a medically supervised, registered nurse and registered diabetes educator coached low-carbohydrate, ketogenic diet to examine the impact it has as a treatment for heart failure with preserved ejection fraction.",False,Heart Failure,Other,Ketogenic Diet,"MLHFQ Questionnaire, PAH-SYMPACT Questionnaire","Change in Metabolic Health: Weight, Change in Metabolic Health: Glucose, Change in Metabolic Health: Insulin, Change in Metabolic Health: Homeostatic Model Assessment for Insulin Resistance (HOMA-IR), Change in Metabolic Health: Albumin, Change in Metabolic Health: Bilirubin total, Change in Metabolic Health: Alanine Transaminase (ALT), Change in Metabolic Health: Aspartate Aminotransferase (AST), Change in Metabolic Health: Alkaline Phosphatase (ALP), Change in Metabolic Health: High Sensitivity C-Reactive Protein (HS-CRP), Change in Metabolic Health: Triglycerides, Change in Metabolic Health: High Density Lipoprotein (HDL), Change in Metabolic Health: Hemoglobin A1c, Change in Metabolic Health: Body Mass Index (BMI), Changes in Physical Function: 6 Minute Walk Test (6MWT), Changes in Physical Function: Maximum Oxygen Consumption (VO2max), Changes in Physical Function: Maximum Work, Changes in Physical Function: 30 Second Sit-to-Stand test (30s STS), Changes in Physical Function: Leg Press - 1 Repetition Maximum, Changes in Physical Function: Chest Press - 1 Repetition Maximum, Changes in Physical Function: Leg Extension - 1 Repetition Maximum, Cardiac Remodeling: Changes in the Left Ventricle (LV) size, Cardiac Remodeling: Changes in the Left Ventricle (LV) thickness, Cardiac Remodeling: Changes in the Left Ventricle (LV) mass, Cardiac Remodeling: Changes in Left Atrium (LA) size, Cardiac Remodeling: Changes in Inferior Vena Cava (IVC) size, Cardiac Remodeling: Changes in estimated Right Atrial Pressure (RAP), Cardiac Remodeling: Changes in Right Ventricle Systolic Pressure (RVSP), Changes in the rate of mitral annulus velocity (e'), Changes in the ratio of transmitral early peak velocity (E) by pulsed wave Doppler over e' (E/e'), PH-HFpEF Only Hemodynamics: Changes in Right Atrial Pressure (RAP), PH-HFpEF Only Hemodynamics: Changes in Pulmonary Artery Pressure (PAP), PH-HFpEF Only Hemodynamics: Changes in Pulmonary Artery Occlusive Pressure (PAOP), PH-HFpEF Only Hemodynamics: Changes in Pulmonary Vascular Resistance (PVR), PH-HFpEF Only Hemodynamics: Changes in Cardiac Output (CO), PH-HFpEF Only Hemodynamics: Changes in Cardiac Index (CI)",National Jewish Health,,All,21 Years,80 Years,252.0,960.0,"Adult, Older Adult",Na,16,Other,Interventional,Treatment,HS-3243 Keto,,2019-07-25,2023-07-24,2023-07-24,2021-06-28,,2024-04-03,2025-07-22T14:56:11.992789
NCT04343430,Acute Heart Failure With Preserved Ejection Fraction - COngestion Discharge Evaluation,AHF-CODE-P,Recruiting,"The AHF-CODE preserved study is a prospective, non-randomized, monocenter study performed in patients with heart failure with preserved ejection fraction admitted for worsening heart failure.

The main objective of the AHF-CODE preserved study is to identify congestion markers (clinical, biological and ultrasound) at the end of hospitalization for acute heart failure that are associated with the risk of all cause death or rehospitalization for acute heart failure within 3 months of hospital discharge.",False,Acute Heart Failure,"Procedure, Procedure, Procedure, Procedure, Behavioral","Clinical examination centered on congestion, Cardio-pulmonary, peritoneal, jugular and renal Doppler ultrasounds and liver elastography, Biological: Blood sample retrieved for biological assessment and biobanking, Telephone interview, Kansas City Cardiomyopathy Questionnaire (KCCQ)","Rate of all-cause death, Rate of re-hospitalisation for acute heart failure, Rate of day-hospital or in-home IV diuretics injection for acute HF","Rate of all-cause death, Rate of re-hospitalisation for acute heart failure, rate of day-hospital or in home IV diuretics injection for acute HF, Rate of all-cause death, Rate of hospitalisation for acute heart failure, Rate of all-cause death, Rate of hospitalisation for acute heart failure, Rate of death from all causes, Rate of hospitalisation for acute heart failure, NYHA (New York Heart Association) class, Natriuretic peptides, Renal function assessed by glomerular filtration rate, Plasma volume, Blood potassium, Liver elastography value, Quality of life assessed by Kansas City Cardiomyopathy Questionnaire","Central Hospital, Nancy, France",,All,18 Years,,216.0,0.0,"Adult, Older Adult",Na,170,Other,Interventional,Diagnostic,2019PI188-2,,2020-08-29,2026-08-29,2028-08-29,2020-04-13,,2023-06-05,2025-07-22T14:56:11.992789
NCT06567925,Sleep Extension to Improve Sleep Efficiency and QoL in HF With Preserved Ejection Fraction: the SLEEP-HF Pilot Study,,Recruiting,"Nearly one-third of US adults have poor sleep quality. Sleep quality refers to sleep efficiency, sleep latency, sleep duration, wake after sleep onset, and movement during the night. Specifically, sleep efficiency (SE) measures how well an individual utilizes their time in bed for restorative sleep and it highly depends on actual sleep duration. Reduced SE is associated with a greater risk for heart failure (HF), which affects \~6.7 million adults in the US alone. HF with preserved ejection fraction (HFpEF) accounts for about half of all HF diagnoses and is associated with poor prognosis (30-50% 5-year mortality from diagnosis) and severely reduced quality of life (QoL). Long-term goal for the investigators is to identify sleep modulation as a potential therapeutic target to improve QoL in HFpEF, with poor SE being present in \~60% of patients with HFpEF. The study is aimed to see if the sleep modulation is feasible and modulating sleep can improve the QoL and functional capacity along with the reduction of inflammation among subjects with HFpEF.",False,Heart Failure With Preserved Ejection Fraction,"Behavioral, Behavioral","Customized Sleep Coaching, Sleep Hygiene Training","Demonstrate the feasibility of a gradual sleep extension strategy combined with sleep hygiene training using a wearable device, Demonstrate the feasibility of a gradual sleep extension strategy combined with sleep hygiene training using a sleep journal, Demonstrate the feasibility of a gradual sleep extension strategy combined with sleep hygiene training using the Pittsburgh Sleep Quality questionnaire., Demonstrate the feasibility of a gradual sleep extension strategy combined with sleep hygiene training using the Epworth Sleepiness Scale at baseline and at the end of the follow-up for subjectively assess sleep quality.",,Virginia Commonwealth University,Sleep Research Society Foundation (SRSF),All,18 Years,,216.0,0.0,"Adult, Older Adult",Na,17,Other,Interventional,Treatment,HM20028346,,2025-01-21,2025-07-01,2025-07-01,2024-08-23,,2025-04-27,2025-07-22T14:56:11.992789
NCT02041130,Renal Denervation in Heart Failure Patients With Preserved Ejection Fraction (RESPECT-HF),RESPECT-HF,Unknown,"Investigators will test a new approach to a form of heart failure (HF) with no current treatment proven to reduce death rates or hospitalisations. Over a third of HF cases have preserved ejection fraction (HFPEF) often on a background of high blood pressure (BP). These ""stiff"" hearts pump strongly but fill inefficiently resulting in poor exercise capacity and high death rates. Treatments that help when heart pumping action is poor are of no benefit in HFPEF. Recently a simple catheter procedure removing excess nerve signals to and from the kidneys (""renal denervation""; RDN) has been able to reduce BP in patients with high BP resistant to multi-drug treatment. Through removing excess nervous drive to the kidneys, heart and circulation this treatment has promise in HF. The investigators will compare effects of RDN and standard medical treatment on heart function, exercise capacity and quality of life in 144 patients with HFPEF",False,Heart Failure,Device,Renal Denervation,Compare the changes in left atrial volume index (LAVi) and/or left ventricular mass index (LVMi) on cardiac magnetic resonance imaging (cMRI) between baseline and 6 months,"Compare the changes in exercise capacity and functional status as assessed by maximal oxygen consumption (VO2max) on cardiopulmonary exercise testing and by 6-minute walk test between baseline and 6 months, Compare the changes in chocardiographic grade of diastolic dysfunction as assessed by Tissue Doppler E/e', (a non-invasive estimate of left atrial filling pressure)., Compare the changes in biomarkers of cardiac load and interstitial fibrosis as assessed by plasma assays of relevant biomarkers, Compare the changes in ventricular-vascular function as evaluated by echocardiographic measures of arterial elastance, Left Ventricular (LV) end-systolic elastance, LV filling pressure, and LV diastolic stiffness between baseline and 6 months, Compare the changes of Quality of life as assessed by the Minnesota Living with Heart Failure between baseline and 6 months., Compare the difference in composite end-point of death or hospitalization with Heart Failure between control arm and treatment arm","National University Hospital, Singapore","University of Otago, Wellington Hospital, University of Auckland, New Zealand, Monash University, Tan Tock Seng Hospital, Changi General Hospital, Singapore Clinical Research Institute",All,18 Years,,216.0,0.0,"Adult, Older Adult",Phase2,144,Other,Interventional,Treatment,DSRB: 2013/00457,,2013-10-01,2015-12-01,2016-12-01,2014-01-20,,2015-01-16,2025-07-22T14:56:11.992789
NCT03923530,Pressure Assessment to Improve Outcomes After TAVR: a Registry,,Completed,"At the Malcom Randall Veterans Affairs Medical Center (MRVAMC), invasive cardiac pressures are routinely recorded after transcatheter aortic valve replacement (TAVR) procedures. Our research has disclosed that patients with abnormal hemodynamics (narrow aortic to ventricular end-diastolic pressure difference, indexed to heart rate) suffer from high long-term mortality, compared with patients with normal hemodynamics.This hemodynamic value can be referred to as the aortoventricular index (AVi). Hypertension and diastolic dysfunction are highly co-morbid conditions among these patients. The selective aldosterone receptor antagonist eplerenone (Inspra) is approved for use in the treatment of hypertension. Research also supports that eplerenone may be able to improve diastolic function.

This prospective study is interested in determining 1) the tolerability of eplerenone, and 2) feasibility of administering the Kansas City Cardiomyopathy Questionnaire (KCCQ-12) among subject with abnormal cardiac hemodynamics after TAVR. This study will set the stage for a pilot randomized trial to evaluate eplerenone versus placebo among patients with abnormal hemodynamics after TAVR.",True,"Hypertension, Aortic Stenosis, Calcific, Quality of Life, Heart Failure With Preserved Ejection Fraction",Drug,Eplerenone,Kansas City Cardiomyopathy Questionnaire (KCCQ-12)-Summary Score,"Kansas City Cardiomyopathy Questionnaire (KCCQ-12)-Physical Limitation Score, Kansas City Cardiomyopathy Questionnaire (KCCQ-12)-Symptom Frequency Score, Kansas City Cardiomyopathy Questionnaire (KCCQ-12)-Quality of Life Score, Kansas City Cardiomyopathy Questionnaire (KCCQ-12)-Social Limitation Score, Systolic Blood Pressure, Diastolic Blood Pressure",North Florida Foundation for Research and Education,Malcom Randall VA Medical Center,All,55 Years,100 Years,660.0,1200.0,"Adult, Older Adult",Early Phase1,12,Other,Interventional,Treatment,201901097,,2019-06-03,2020-02-20,2020-02-27,2019-04-22,2020-05-28,2020-05-28,2025-07-22T14:56:11.992789
NCT03163030,Autonomic Regulation Therapy in Heart Failure With Preserved Ejection Fraction,,Completed,The ANTHEM-HFpEF Study is designed to demonstrate the safety and efficacy of vagus nerve stimulation (VNS) with the Cyberonics VNS Therapy System for the treatment of subjects with symptomatic heart failure with preserved and mid-range ejection fraction.,False,Congestive Heart Failure,Device,Vagus Nerve Stimulation (VNS),Adverse Events,"Cardiac Size (LAVI), Functional Status (6MWD), Quality of Life Score, Functional Status (NYHA Class), Cardiac Function (E/E'), Cardiac Size (LV mass index), Autonomic Function (HRV), Blood Biomarkers","Cyberonics, Inc.",,All,18 Years,,216.0,0.0,"Adult, Older Adult",Na,52,Industry,Interventional,Treatment,C-04,,2014-08-01,2019-12-01,2021-12-01,2017-05-22,,2023-05-06,2025-07-22T14:56:11.992789
NCT06125925,Catheter Ablation in Atrial Fibrillation Patients With HFpEF (STABLE-SR IV Trial),,Recruiting,To investigate whether RFCA is superior to AADs in AF patients with HFpEF on the basis of optimized anti-heart-failure drug therapy regarding their longterm clinical outcomes.,False,"Atrial Fibrillation, HFpEF - Heart Failure With Preserved Ejection Fraction","Procedure, Drug","Radiofrequency catheter ablation (RFCA), Medical Therapy","Composite endpoint of worsening heart failure requiring unplanned hospitalizations or urgent visits, and cardiovascular death (Time-to-first event analysis)","Time to hospitalization or urgent visits for heart failure, Time to hospitalization for heart failure, Time to urgent visits for heart failure, Time to cardiovascular death, Time to all-cause death, Time to cardiovascular hospitalization, Total number of worsening heart failure events and cardiovascular deaths, Change in quality of life - KCCQ score, Change in quality of life - MLWHFQ, Change in 6-minute walk test from baseline to Month 3 and Month 12, Change in H2FPEF score from baseline to Month 3 and Month 12, Change in N-terminal pro-B type natriuretic peptide (NT-proBNP) from baseline to Month 3 and Month 12, Change in NYHA class from baseline to Month 3, 6 and 12, Time to change of diuretics, Change in atrial fibrillation burden, Time to Atrial Fibrillation recurrence (RFCA arm)",The First Affiliated Hospital with Nanjing Medical University,,All,18 Years,80 Years,216.0,960.0,"Adult, Older Adult",Na,436,Other,Interventional,Treatment,2023-SR-659,,2023-11-06,2026-11-01,2026-11-01,2023-11-09,,2023-12-11,2025-07-22T14:56:11.992789
NCT05584319,EMPAGUM: Effects of Empagliflozin on Gut Microbiota in Heart Failure With a Preserved Ejection Fraction,,Enrolling By Invitation,"Empagliflozin was recommended for patients with heart failure with reduced ejection fraction (HFrEF) in 2021 European Society of Cardiology (ESC) guidelines (Class of Recommendation Ia) and patients with heart failure with preserved ejection fraction (HFpEF) in 2022 American Heart Association (AHA) guidelines (Class of Recommendation IIa). However, the physiopathologic mechanisms in its effects on HFpEF are not clear. Studies illustrate that gut microbiota plays an essential role in the progress of the heart failure. Studies on mice found that sodium-glucose cotransporter-2 inhibitors (sglt-2i) could affect the intestinal microbiota in mice. The purpose of this study is to clarify the changes of gut microbiota in the patients with HFpEF taking Empagliflozin and explore the role of gut microbiota in this process.",False,"Heart Failure, Heart Failure With Preserved Ejection Fraction",Drug,Empagliflozin 10 Mg,intestinal microbiota diversity,"Major Adverse Cardiovascular Events (MACE), N-terminal prohormone of B-type natriuretic peptide ( NT-proBNP ), soluble suppression of tumorigenicity 2 (sST2), serum SCFAs level",Zhijun Sun,,All,18 Years,,216.0,0.0,"Adult, Older Adult",Phase4,100,Other,Interventional,Treatment,2022PS999K,,2022-12-15,2024-10-01,2025-10-01,2022-10-18,,2022-12-23,2025-07-22T14:56:11.992789
NCT05651919,PBMC as Biomarkers of Diabetic Cardiomyopathy,MOBI,Recruiting,"Type 2 diabetes (T2D), especially when associated with metabolic syndrome (MS) is at high risk to develop heart failure with preserved ejection fraction (HFpEF) or heart failure with mildly reduced ejection fraction (HFmrEF), and the specific impact of T2D+MS in cardiac function impairment is usually known as ""diabetic cardiomyopathy"" (DC). Cardiac remodelling (ie hypertrophy) and subtle myocardial dysfunction are highly prevalent in T2D+MS but not specific enough to predict further HFpEF or HFmrEF. Also, current biomarkers can identify but do not predict HFpEF or HFmrEF in T2D patients; Furthermore, specific biomarkers are needed. Peripheral blood mononuclear cells (PBMC) obtained from a peripheral blood sample can provide insights from calcic and inflammatory pathways, and may identify more specific molecular signatures shared between T2D+MS and HFpEF.",False,"Type 2 Diabetes, Metabolic Syndrome, Heart Failure With Preserved Ejection Fraction, Heart Failure With Mildly Reduced Ejection Fraction","Biological, Behavioral, Behavioral","Blood test, quality of life Questionnaire, Diet habits questionnaire","Comparison of Initial level of Ca2+ fluxes from T2D+MS patients vs non T2D+MS patients, according to the presence or not of HFpEF or HFmrEF, Comparison of amplitude of Ca2+ fluxes from T2D+MS patients vs non T2D+MS patients, according to the presence or not of HFpEF or HFmrEF, Comparison of area under curve of Ca2+ fluxes from T2D+MS patients vs non T2D+MS patients, according to the presence or not of HFpEF or HFmrEF, Comparison of slope of the response to pharmacological stimulation of Ca2+ fluxes from T2D+MS patients vs non T2D+MS patients, according to the presence or not of HFpEF or HFmrEF, Comparison of the inflammatory profile of PBMC from T2D+MS patients vs non T2D+MS patients, according to the presence or not of HFpEF or HFmrEF",,Hospices Civils de Lyon,,All,40 Years,80 Years,480.0,960.0,"Adult, Older Adult",,100,Other,Observational,,69HCL22_0580,2022-A02435-38,2023-05-23,2026-08-23,2026-08-23,2022-12-15,,2025-07-09,2025-07-22T14:56:11.992789
NCT06685237,Copenhagen Heart Failure With Preserved Ejection Fraction,CPH-HFpEF,Recruiting,"Heart failure with preserved ejection fraction (HFpEF) has grown to become the dominant form of heart failure (HF) worldwide, in tandem with ageing of the general population and the increasing prevalence of obesity, diabetes mellitus and hypertension. In 2020, \> 70% of patients with heart failure had preserved ejection fraction. The incidence and prevalence of HFpEF has been growing by 10% every 10 years relative to HF with reduced ejection fraction (HFrEF). In 2017, the prevalence of HFpEF varied from 1% to 14% based on available data from Europe and USA. HFpEF is associated with high morbidity and mortality, and patients with HFpEF have similarly high hospitalization rates as patients with HFrEF. Hence, HFpEF poses a substantial global health challenge. Despite its prevalence, HFpEF remains undiagnosed and underrecognized, necessitating a comprehensive approach to both identification and management.

Ensuring successful treatment necessitates early identification of HFpEF. Consequently, a targeted screening strategy has been devised for the identification of HFpEF patients. Given the higher prevalence of heart failure (HF) in the elderly population, testing the screening strategy is imperative to customize it to the specific needs of vulnerable patients who may be more inclined to decline participation in the screening program.",False,Heart Failure With Preserved Ejection Fraction (HFPEF),,,The primary objective of this study is to pilot the identification and screening procedures outlined in this protocol.,"Secondarily, we aim to assess the willingness of identified Danish adults with risk factors for HFpEF to participate in the study, as well as to identify and address any barriers to their involvement.",Tor Biering-Sørensen,,All,50 Years,89 Years,600.0,1068.0,"Adult, Older Adult",,5000,Other,Observational,,CPH-HFpEF,H-24022361,2025-02-28,2025-11-28,2026-03-28,2024-11-12,,2025-03-05,2025-07-22T14:56:11.992789
NCT05338437,NMES in HF Patients to Improve Functional Recovery Following Hospitalization,NeuHFRecover,Completed,"The goal of this research study is to understand whether an at-home exercise program started after hospitalization for HFpEF, and continuing for 4 weeks following discharge from the hospital, can preserve or improve physical function.",False,Heart Failure With Preserved Ejection Fraction,Device,Neuromuscular electrical stimulation,6 Minute Walk Distance (6MW),"Short Physical Performance Battery, Medical Outcomes Short Form 36, Medical Outcomes Short Form 36 - Role Emotional, Medical Outcomes Short Form 36 - Social Function, Medical Outcomes Short Form 36 - Vitality, Medical Outcomes Short Form 36 - General Health, Medical Outcomes Short Form 36 - Bodily Pain, Medical Outcome Short Form 36 - Role Physical, Medical Outcomes Short Form 36 - Physical Function, Katz Index of Independence in Activities of Daily Living, Lawton Instrumental Activities of Daily Living (IADL) Scale",University of Vermont Medical Center,,All,50 Years,90 Years,600.0,1080.0,"Adult, Older Adult",Na,9,Other,Interventional,Supportive Care,STUDY00001757,,2022-02-07,2023-09-30,2023-09-30,2022-04-21,,2024-11-25,2025-07-22T14:56:11.992789
NCT04739215,Effects of SGLT2 Inhibition on the Mechanisms of Cardiac Damage in the Diabetic Patient With HFpEF,CARDIA-STIFF,Unknown,The main aim of this study is to identify the underlying mechanisms of Sodium-glucose co-transporter-2 (SGLT2) inhibitors which are associated to better outcomes in patients with Diabetes mellitus type 2 and Heart Failure with preserved Ejection Fraction.,False,"Diabetes Mellitus, Type 2, Heart Failure With Preserved Ejection Fraction","Drug, Drug","Dapagliflozin 10 MG [Farxiga], Placebo","Functional Main Objective: Impact of iSGLT2 on LV diastolic properties in terms of the change in LV stiffness constant (S+) at the peak of exercise., Main Structural Objective: Changes in serum levels of procollagen type I C-terminal propertied (PICP, ng/mL)","Changes in LV stiffness constants (S+ and S-)., Changes in the slope, Emax, of the end-systolic pressure-volume relationship, Impact of iSGLT2 on myocardial remodeling., Correlation of myocardial remodeling patterns with the intrinsic diastolic properties of chamber VI with systolic function., Relative contribution of the intrinsic diastolic properties of the LV and the flow patterns on filling pressures and their modulation under treatment with iSGLT2., Changes in serum levels of collagen type I C-terminal telopeptide to matrix metalloproteinase ratio (CITP:MMP-1), Changes in N-terminal pro brain natriuretic peptide (pg/mL), Changes in high sensitivity troponin T (pg/mL)",Hospital General Universitario Gregorio Marañon,"University of Navarra, Instituto de Salud Carlos III, Fundación para la Investigación Biomédica del Hospital Gregorio Maranon",All,18 Years,75 Years,216.0,900.0,"Adult, Older Adult",Phase4,62,Other,Interventional,Treatment,FIBHGM-CARDIA-STIFF,2019-002046-20,2021-01-15,2022-12-30,2022-12-30,2021-02-04,,2021-02-04,2025-07-22T14:56:11.992789
